Date,Headline,Type,URL,Text
2020/12/30,Building Bridges to Help the Economy Through Covid,Commentary,https://www.wsj.com/articles/building-bridges-to-help-the-economy-through-covid-11609369746,"The year is almost gone—and 2020 won’t be missed. The future looks brighter thanks to some truly amazing scientific work, but a thoroughly vaccinated America is probably six to nine months away. To limit the damage while getting from here to there, we need to build two (figurative) bridges: a public-health bridge and an economic-relief bridge. The two make a natural pair because the economy won’t get back to normal until the pandemic is under control.
President Trump’s grudging signature on a relief bill allows us to start building roughly half of the necessary economic bridge. I say “roughly half” because the $900 billion that Congress appropriated is about 40% of the amount provided in the Cares Act in March. (Should the $600 checks be boosted to $2,000, the bridge will be longer.) The Federal Reserve also unveiled a series of emergency responses to the economic crisis back then. Those timely and effective actions helped get the economy through the third quarter of 2020 in surprisingly good shape. 
As the pandemic worsened and the main provisions of the Cares Act started to phase out over the summer, it became clear that we needed another economic relief package. Clear to everyone, that is, except Senate Majority Leader Mitch McConnell and his colleagues. They refused to budge until the virus was raging out of control, the economy was looking a bit shaky, and millions faced eviction at Christmas.
Incredibly, Republicans even tried to hamstring the Fed. What little medicine is left in its cabinet is mostly slow-acting—not the sort of thing that can give the economy a quick boost if needed. There’s one big exception, however: emergency lending. Yet Treasury Secretary Steven Mnuchin decided to make that harder, and some Republican senators then tried to make it impossible. 
In contrast, Congress has an abundance of fast-acting palliatives at its disposal—such as extended and enhanced unemployment benefits, food stamps and other grants to the needy, measures to stave off evictions and bankruptcies, and simply writing checks. Now that Mr. Trump has spared a minute from his busy golfing schedule to sign the bill, many of these remedies will be continued or restarted. 
This matters greatly. The sooner the economy gets back to full employment, the less we’ll need to worry about scarring from the deep recession. With a faster recovery, fewer workers will lose their jobs permanently or see their skills atrophy. Fewer firms will go bankrupt. Fewer state and local governments will see their finances ruined and their public services decimated. 
But it’s a gigantic economy, and $900 billion is unlikely to be enough. Fortunately, President-elect Joe Biden understands that.
A public-health bridge to the second half of 2021 is also essential. Sadly, its prospects look poor, among other reasons because of the way Mr. Trump and his administration have politicized the response to the pandemic. Yes, marvelous work by brilliant scientists and dedicated medical professionals has produced excellent vaccines far sooner than we had any right to expect. But apart from that phenomenal success, the country has done just about everything wrong in fighting Covid-19—including, most recently, fumbling the vaccine rollout.
And at horrific cost. More than 19 million Americans have now been infected, and about 340,000 have died. These numbers place us among the worst-performing nations on earth. As this is written, the latest data from Johns Hopkins rank the U.S. as eighth worst among 217 countries in Covid cases per capita (nestled between French Polynesia and Bahrain) and 14th worst in deaths per capita (between Bulgaria and Mexico). 
Our neighbors to the north put us to shame. Covid illnesses and deaths per million people (so far) are about 60,000 and 1,050 here, but only about 15,000 and 420 in Canada. Had we achieved Canadian numbers, more than 200,000 dead Americans would be alive today. Do Canadians have better genes? No. Just better government.
The much-needed public-health effort requires simple measures like masks, social distancing, testing, tracing—and, perhaps above all, responsible behavior. Yet Mr. Trump and his enablers seem determined to turn these straightforward measures into tests of political will. Mr. Biden will stop promoting that craziness, but not until Jan. 20.
Decades from now, historians will look with wonder at how Republicans disparaged wearing masks and social distancing as infringements on individual liberty. But long before that, millions more Americans will have fallen ill and hundreds of thousands will have died. For them, Jan. 20 will not come soon enough.
Mr. Blinder, a professor of economics and public affairs at Princeton, served as vice chairman of the Federal Reserve, 1994-96.
Copyright ©2020 Dow Jones & Company, Inc. All Rights Reserved. 87990cbe856818d5eddac44c7b1cdeb8
"
2020/12/30,2020 Hindsight and a Look Ahead,Commentary,https://www.wsj.com/articles/2020-hindsight-and-a-look-ahead-11609369459,"Let’s bid farewell to a horrible year by reviewing my 2020 predictions and offering prophecies for the coming year. 
Overall, I made 20 correct forecasts—nine incorrect and three are up in the air. 
What I got right: Mayor Pete Buttigieg won the Iowa caucuses, Joe Biden secured the Democratic nomination, President Trump trailed in the popular vote and carried Florida and Ohio while attracting more African-American and Hispanic voters than in 2016. The presidential election came down to Michigan, Pennsylvania and Wisconsin, settled by a wider margin than Mr. Trump’s combined 77,736-vote edge in 2016. Mr. Biden took them by 257,025 votes and won the election. As forecast, Democrats kept the House but with a reduced margin.
There was a second U.S.-China trade deal—and it wasn’t comprehensive. Nor did China buy the $141.7 billion in American goods it promised; by November, Beijing had bought only $82 billion. 
Middle East refugee flows increased but were mostly contained within the region. Libya became more chaotic, and the Islamist threat in the sub-Sahara grew. Iran continued disrupting Iraq, but Iraq’s government appears more stable.
The New England Patriots didn’t make it to the American Football Conference title game—they lost in the first round to wild-card Tennessee—and the “Greek Freak,” Giannis Antetokounmpo, was the National Basketball Association’s most valuable player.
Now my 2020 prediction bloopers. Climate guesses were a mixed bag: As predicted, U.S. carbon emissions dropped, but mostly because of the unpredicted Covid-induced economic contraction, not innovation. Global recession forced Paris climate accord signatories (including China and India) to reduce CO2 emissions, the opposite of what I predicted. 
The Democratic convention took one ballot, not more. Iowa didn’t go Democratic in November. Because of Covid, there was recession instead of 2.3% growth, and jobs and wages didn’t increase for workers. No U.S.-U.K. trade agreement. The Ravens didn’t win Super Bowl LIV, and their quarterback, Lamar Jackson, wasn’t MVP.
Three predictions are unresolved. Special counsel John Durham’s investigation is pending. I stand by my forecast that the U.S. dominates the competition for medals at what are now the 2021 Tokyo Olympics. The question of who controls the Senate will be settled in Tuesday’s Georgia runoffs: I still believe Republicans retain a narrow majority. They better, since some of my new prognostications hinge on it.
So for 2021 predictions: Mr. Biden’s approval rating a year from now is at least the 51% he received in November because the economy grows at better than 3.5%. Mr. Trump doesn’t declare for president next year because he doesn’t want the personal financial-reporting and contribution limits that would impose, but he keeps all options open for 2024 so he’s kingmaker even if he doesn’t run again.
As a private citizen, Mr. Trump needs better lawyers than Rudy Giuliani, Sidney Powell and Lin Wood. The Manhattan district attorney and New York state attorney general will dog him over personal finances.
Republicans maneuver to define themselves with Mr. Trump out of the White house but still on Twitter. Mr. Biden’s traditional Democrats and his party’s socialist wing argue about policy, personnel and bipartisanship, but by year’s end Mr. Biden is still governing as a normal liberal.
At least two Biden cabinet nominees aren’t confirmed. No major tax increase or Green New Deal-type climate measure passes. The Supreme Court reins in several of the new administration’s regulatory actions. There’s bipartisan legislation on Covid, infrastructure and trade. Violent urban crime grows. By July there are at least four effective coronavirus vaccines used by more than half the country.
North Korea launches an advanced intercontinental ballistic missile or conducts another nuclear test. Iran ramps up its nuclear program. China offers a big emissions reduction for ending U.S. arms sales to Taiwan. Mr. Biden and Prime Minister Boris Johnson strike that U.S.-U.K. trade deal. The West decides how to counter Chinese intellectual-property theft and foreign-aid manipulation through its Belt and Road Initiative. There’s less difference than expected between the Biden and Trump policies on the Mideast and China.
Alabama is crowned college-football champion. The Kansas City Chiefs win another Super Bowl, but Green Bay’s Aaron Rodgers is NFL MVP. Peyton Manning, Charles Woodson and a receiver— Reggie Wayne, Torry Holt or Calvin Johnson —are inducted into the Hall of Fame in Canton, Ohio. Taylor Swift’s “Folklore” album wins a Grammy and “The Crown” an Emmy. 
These are my guesses for 2021, but life often takes us by surprise. May 2021 do so less cruelly than this year did.
Mr. Rove helped organize the political-action committee American Crossroads and is author of “The Triumph of William McKinley” (Simon & Schuster, 2015).
Copyright ©2020 Dow Jones & Company, Inc. All Rights Reserved. 87990cbe856818d5eddac44c7b1cdeb8
"
2020/12/30,The U.S. General Who Steered China Right,Commentary,https://www.wsj.com/articles/the-u-s-general-who-steered-china-right-11609369333,"Of my many international students at Cornell, those from China are among the most eager to take up driving in America. Partly this is due to the popularity of cars in China, the most rapidly motorizing nation on earth. But it’s also because traffic in China and the U.S. follows the same rule of the road. Vehicles in both countries drive on the right. Learn to drive here and you can drive there.
China didn’t always drive right; before World War II its traffic ran on the left. That changed at midnight on Dec. 31, 1945. As the new year dawned, traffic throughout the land shifted from one side to the other. It was the work of Gen. Albert Wedemeyer of the U.S. Army, whom President Franklin D. Roosevelt had tapped to replace Joseph Stilwell as commander of American forces in China. Wedemeyer’s move was intended, at least ostensibly, to reduce accidents on China’s roads, which were clogged by American jeeps and trucks. But he likely had an ulterior motive.
The Japanese occupation of China prompted Wedemeyer’s decision. By early 1945, imperial troops had been forced out of Burma and the Pacific islands. But two million remained in mainland Asia, mostly in southern China. To drive the Japanese out, Wedemeyer launched Operation Carbonado. It required the marshaling of two divisions of Chinese troops by air from Burma, then moving them 700 miles south from Chongqing to the coast in a convoy of American trucks.
But because the vehicles were driven on the “wrong” side of the road, traffic accidents ensued. After driver education campaigns failed, Wedemeyer proposed to Chiang Kai-shek that China’s rule of the road be inverted. The generalissimo agreed. So did most Chinese; the move-left tradition had the mark of British imperialism.
Wedemeyer ordered a publicity campaign in preparation. “Posters were placed on telephone poles and shop windows,” he recalled in his memoir, “showing diagrammatically how traffic would move.” 
But there was resistance. Editorials appeared in the local press “criticizing the idea of breaking an old Chinese tradition and urging the Generalissimo to reconsider.” Suspicious, Wedemeyer ordered an investigation. The source turned out to be the British Embassy, whose officials were convinced that Wedemeyer was preparing for an invasion of another sort—the sale of American automobiles.
They were probably right. The Japanese surrender on Sept. 2, 1945, mooted Carbonado. With U.S. Army vehicles soon to leave, there was no need to alter traffic across China. Yet the plan proceeded.
Why? Wedemeyer was a patriotic American, and he might well have had the U.S. automobile industry in mind. Changing China’s traffic would pave the way for American cars in a market long dominated by the British. Indeed, he recalled with pleasure the “thrilling experience of standing on the balcony of my tower apartment in the Cathay Hotel in Shanghai to watch the traffic at midnight change over to move along the right side of the road.”
It wasn’t until the 1980s that Detroit moved into China, and it was only possible because Mao chose to keep move-right traffic flow after 1949—the same pattern used by the Soviet Union. Today, China’s roads are flooded with Buicks, Teslas and Fords. That these—and all other vehicles—move on the right like those in Parsippany, N.J., or Peoria, Ill., is daily proof that America’s most universal export to China is not Hollywood or McDonald’s but simply the way that we drive.
Mr. Campanella is an associate professor of city planning and director of the urban studies program at Cornell University.
Copyright ©2020 Dow Jones & Company, Inc. All Rights Reserved. 87990cbe856818d5eddac44c7b1cdeb8
"
2020/12/30,Legion of Gloom,Best of the Web,https://www.wsj.com/articles/legion-of-gloom-11609366535,"Even Dr. Anthony Fauci has soured on the idea of closing schools in response to Covid-19, amid overwhelming evidence of student harm and a lack of evidence of public benefit. But the destructive policy seems to have a new lease on life in politics. In a dreary Tuesday speech in Wilmington, Del., President-elect Joe Biden suggested that some schools should remain closed through April--and even longer if there is not another huge round of federal spending on education. 
Mr. Biden, discussing the period following his Jan. 20 inauguration, said:
Taxpayers may be even more depressed to learn they will now be asked to fund a Biden administration program to persuade people to ignore the message of the Biden presidential campaign. As candidates, Mr. Biden and his running mate, Sen. Kamala Harris, cast doubt on the safety of any vaccines approved by the Trump administration. On Tuesday, after modestly acknowledging “there’s a vaccination hesitancy in many communities,” Mr. Biden promised “a massive public education campaign to increase vaccine acceptance. We’ll do everything we can to show the vaccines are safe and critically important for one’s own health and that of their families and the communities.” 
He then promised to “ensure vaccinations are free of charge,” perhaps unaware of existing federal policy. Then Mr. Biden’s speech got a little more confusing when he said:
Sounds like someone’s bucking for a demotion. 
Mr. Biden’s remarks on the economy were also puzzling. “Our economy is poised to come back and come alive,” he said. Real gross domestic product increased at an annual rate of 33.4% in the third quarter of this year, a historic rebound after the second quarter’s sharp decline amid the shutdowns. Most economists expect the current quarter won’t be so spectacular, but still expect strong growth in the neighborhood of 5%. 
With two vaccines approved—and more vaccines likely to be approved within weeks—the main problem may be that too many governors believed the Biden campaign’s message that the Trump administration would not be able to quickly approve safe and effective vaccines. The Trump administration’s Operation Warp Speed seems to be distributing vaccines faster than states and health care providers are prepared to administer them. 
These are early days and around the holidays there may be some lag in the reporting of data, so perhaps vaccinations have proceeded even faster than the nearly 2.6 million doses so far counted by the federal Centers for Disease Control. But when the virus struck in the spring, if anyone had said that by December the federal government would be distributing vaccines faster than care providers could inoculate patents, any reasonable person would have called that a rare Washington success. Most of the credit of course goes to the scientists at pharmaceutical companies who made it happen. Yet Mr. Biden is still acting as if he’s about to lead an effort to do the hard part. On Tuesday he said:
By all means, keep speaking to all the state and local officials who may not have been prepared for the possibility of a medical success. But the overheated rhetoric suggesting Mr. Biden’s about to lead some sort of Manhattan Project amounts to a PR campaign for new spending regardless of scientific progress. 
Meanwhile in the Senate, Mr. Biden’s onetime presidential campaign rival Sen. Bernie Sanders is singing an accompanying tune, making ridiculous economic comparisons to justify massive federal interventions. This week Mr. Sanders said, “The working class of this country today faces more economic desperation than at any time since the Great Depression of the 1930s.”
Unemployment in the 1930s soared to around 25%. Today it’s below 7%, clocking in at 6.7% in November. The U.S. unemployment rate has reached this level or higher at some point in every decade since the 1930s, including for the entire Obama-Biden first term. 
OK, gloomers.
***
Mr. Freeman is the co-author of “The Cost: Trump, China and American Revival.”
***
Follow James Freeman on Twitter and Parler.
Subscribe to the Best of the Web email.
To suggest items, please email best@wsj.com.
(Lisa Rossi helps compile Best of the Web.)
***
Copyright ©2020 Dow Jones & Company, Inc. All Rights Reserved. 87990cbe856818d5eddac44c7b1cdeb8
"
2020/12/30,Everybody Wants Credit for the Covid Vaccine,Letters,https://www.wsj.com/articles/everybody-wants-credit-for-the-covid-vaccine-11609360492," Graham T. Allison correctly highlights the importance of competitive private enterprise in developing Covid-19 vaccines (“Who Made the Vaccine Possible? Not WHO,” op-ed, Dec. 24) but glosses over the primary importance of publicly funded basic research. That is, research not motivated by practical applications and not conducted by private companies, but motivated by the simple goal of understanding how the natural world works and conducted largely in public institutions.
Second is the essential role of governments and public funding, not only to support the basic research, but also to provide the legal framework essential for a market economy. I don’t deny the crucial role of private enterprise from that point onward, but to conclude that pharmaceutical companies and Operation Warp Speed deserve the vast bulk of the credit for the development of the vaccines is a selective reading of how science works.
William Horns
Fitchburg, Wis.
Mr. Allison doesn’t take his analysis to its logical conclusion. The researchers who formulated the vaccine were in the right place at the right time, with funding guarantees and advance-purchase orders. While their task wasn’t trivial, it appears that tens of laboratories around the world have completed it successfully.
The game changer was Operation Warp Speed. Without it, we would be sitting here waiting for a vaccine announcement, and then wondering when production would start.
 Alfred Nobel endowed his chemistry prize for those who have “conferred the greatest benefit to mankind.” A Nobel Prize in Chemistry for President Trump may be in order.
David Lewis
The Villages, Fla.
I wonder if it occurred to Rep. Alexandria Ocasio-Cortez, after she received her Covid-19 vaccine, that without the animal spirits of capitalism, there wouldn’t have been a vaccine to take. And when Sen. Bernie Sanders got his vaccine, did he realize it was the fruit of the push from a president he vilifies and an economic system in which profit-seeking drives innovation? The economic system that these politicians support, run by central planner in Washington, couldn’t have completed this mission in time.
Don Sullivan
Venice, Fla.
Who made a vaccine possible? The 30,000 volunteers who took a chance and joined a trial before it was proved to be safe. I have seen little acknowledgment of our contribution.
Once the vaccine was shown to be effective, we volunteers thought we’d be “unblinded”—told whether we were given the vaccine or a placebo—so the placebo group could be given the vaccine it helped make possible.
We haven’t. The FDA wants to milk some more data from our bodies to learn something more about the vaccine’s long-term safety, and it is content to sacrifice our short-term safety to get it.
William Tindall
Church Hill, Tenn.
Copyright ©2020 Dow Jones & Company, Inc. All Rights Reserved. 87990cbe856818d5eddac44c7b1cdeb8
"
2020/12/30,Christmas Messages From the Editorial Page,Letters,https://www.wsj.com/articles/christmas-messages-from-the-editorial-page-11609360414,"Thank you for republishing Vermont Royster’s 1949 editorial “In Hoc Anno Domini” (Dec. 24). It is so important, in our world threatened by critical theory and cancel culture, to understand where we came from and the importance of freedom and individual responsibility in delivering us from the “darkness” and “oppression.” Your courage in sharing Paul’s words to the Galatians is one reason that I’ve been a subscriber for more than 60 years.
William Beattie
Danbury, Conn.
I was struck by the ocean of difference in depth between neighboring opinion articles on Christmas Eve. Royster’s “In Hoc Anno Domini” ends by appealing to the best parts of human nature: “And so Paul, the apostle of the Son of Man, spoke to his brethren, the Galatians, the words he would have us remember afterward in each of the years of his Lord: Stand fast therefore in the liberty wherewith Christ has made us free and be not entangled again with the yoke of bondage.” 
Yet on the adjacent page, Phil Gramm and Mike Solon’s “In Defense of Scrooge, Whose Thrift Blessed the World” (op-ed) honors Scrooge and Marley and “the wealth accumulators of our own age.” It concludes that “Scrooge’s wealth accumulation would have benefited far more people than anything he gave to charity after his reclamation.” Wealth hoarding—not driven by one of the better parts of our nature—is only another form of the bondage that Royster warns against.
John Casana
Annandale, Va.
Copyright ©2020 Dow Jones & Company, Inc. All Rights Reserved. 87990cbe856818d5eddac44c7b1cdeb8
"
2020/12/30,"‘How’s Your Drink?’ Never Been More Needed, Cheers",Letters,https://www.wsj.com/articles/hows-your-drink-never-been-more-needed-cheers-11609360352," Eric Felten has done yeoman’s work in cheering Covid shut-ins who have emptied the liquor larder, sweeping away years of dead spiders in search of anything potable and alcoholic (“Here’s to Simple Pleasures,” Bookshelf, Dec. 26). He is an essential worker in these dry times and I toast his spirit(s).
Paul Bloustein
Cincinnati
Copyright ©2020 Dow Jones & Company, Inc. All Rights Reserved. 87990cbe856818d5eddac44c7b1cdeb8
"
2020/12/30,Enough Lunchbag Letdown: Full Deductibility for Meals,Letters,https://www.wsj.com/articles/enough-lunchbag-letdown-full-deductibility-for-meals-11609360287,"Your editorial “The Martini Lunch Tax Code” (Dec. 22) criticizes the temporary return of business meals to full deductibility as bad tax policy. To the contrary, small businesses depend on these meals to grow their businesses. Unable to rely on Super Bowl advertising or stadium sponsorships, they build relationships one by one.
Business meals were an easy target for regulators due to the abuse of the three-martini lunch. But that was resolved decades ago, even if the stigma persists. As a certified public accountant and tax attorney for small businesses, I can attest that the Internal Revenue Code now has substantiation rules for these expenses that are stricter than most other deductions.
The full deductibility of meals is fair tax policy. When Congress picks and chooses which legitimate expenses to allow, the system goes out of balance. The limitation of the deduction for business meals has always hit small businesses disproportionately. Full deductibility, even on a temporary basis, is a first step towards reinstating fairness between small and big business. The policy should be praised, not bludgeoned. In a post-Covid-19 environment, business meals will play an important role in the revitalization of small business.
E. Martin Davidoff
Hightstown, N.J.
Copyright ©2020 Dow Jones & Company, Inc. All Rights Reserved. 87990cbe856818d5eddac44c7b1cdeb8
"
